{
  "schema_version": "1.1",
  "brief_id": "tennis-editorial-001",
  "brief_version": 2,
  "status": "FROZEN",
  "facts": {
    "deliverable": "editorial sports photograph",
    "aspect_ratio": "16:9",
    "model": "Nano Banana Pro",
    "reference_mode": "none",
    "subject": {
      "sex": "male",
      "age_range": "30–35",
      "sport": "tennis"
    },
    "composition": {
      "camera": "low side-on camera close to the player",
      "perspective": "compressed moderate telephoto perspective",
      "player_position": "large in frame, center-right",
      "action": "deep lateral two-handed backhand stretch toward camera-left",
      "racket_ball": "racket and yellow ball in the left third, just before contact",
      "legs": "one leg bent and planted; opposite leg extends strongly toward the right",
      "court_depth": "only a narrow strip of clay behind the player before the courtside wall",
      "net_visibility": "no visible tennis net"
    },
    "environment": {
      "location": "Roland-Garros",
      "surface": "red clay",
      "wall_relation": "courtside wall sits immediately behind the player",
      "stands": "packed spectator stands rise directly above the wall",
      "crowd_focus": "softly out of focus"
    },
    "look": {
      "expression": "natural controlled expression",
      "anatomy": "realistic anatomy",
      "clay": "restrained clay spray",
      "photography": "live-match editorial photography"
    }
  },
  "field_states": {
    "aspect_ratio": {
      "state": "LOCKED",
      "source_type": "user",
      "source_id": "user+composition-source",
      "prompt_required": false
    },
    "composition.action": {
      "state": "LOCKED",
      "source_type": "derived",
      "source_id": "user+composition-source",
      "prompt_required": true
    },
    "composition.camera": {
      "state": "LOCKED",
      "source_type": "derived",
      "source_id": "user+composition-source",
      "prompt_required": true
    },
    "composition.court_depth": {
      "state": "LOCKED",
      "source_type": "derived",
      "source_id": "user+composition-source",
      "prompt_required": true
    },
    "composition.legs": {
      "state": "LOCKED",
      "source_type": "derived",
      "source_id": "user+composition-source",
      "prompt_required": true
    },
    "composition.net_visibility": {
      "state": "LOCKED",
      "source_type": "derived",
      "source_id": "user+composition-source",
      "prompt_required": true
    },
    "composition.perspective": {
      "state": "LOCKED",
      "source_type": "derived",
      "source_id": "user+composition-source",
      "prompt_required": true
    },
    "composition.player_position": {
      "state": "LOCKED",
      "source_type": "derived",
      "source_id": "user+composition-source",
      "prompt_required": true
    },
    "composition.racket_ball": {
      "state": "LOCKED",
      "source_type": "derived",
      "source_id": "user+composition-source",
      "prompt_required": true
    },
    "deliverable": {
      "state": "LOCKED",
      "source_type": "user",
      "source_id": "user+composition-source",
      "prompt_required": true
    },
    "environment.crowd_focus": {
      "state": "LOCKED",
      "source_type": "user",
      "source_id": "user+composition-source",
      "prompt_required": true
    },
    "environment.location": {
      "state": "LOCKED",
      "source_type": "user",
      "source_id": "user+composition-source",
      "prompt_required": true
    },
    "environment.stands": {
      "state": "LOCKED",
      "source_type": "user",
      "source_id": "user+composition-source",
      "prompt_required": true
    },
    "environment.surface": {
      "state": "LOCKED",
      "source_type": "user",
      "source_id": "user+composition-source",
      "prompt_required": true
    },
    "environment.wall_relation": {
      "state": "LOCKED",
      "source_type": "user",
      "source_id": "user+composition-source",
      "prompt_required": true
    },
    "look.anatomy": {
      "state": "LOCKED",
      "source_type": "user",
      "source_id": "user+composition-source",
      "prompt_required": true
    },
    "look.clay": {
      "state": "LOCKED",
      "source_type": "user",
      "source_id": "user+composition-source",
      "prompt_required": true
    },
    "look.expression": {
      "state": "LOCKED",
      "source_type": "user",
      "source_id": "user+composition-source",
      "prompt_required": true
    },
    "look.photography": {
      "state": "LOCKED",
      "source_type": "user",
      "source_id": "user+composition-source",
      "prompt_required": true
    },
    "model": {
      "state": "LOCKED",
      "source_type": "user",
      "source_id": "user+composition-source",
      "prompt_required": false
    },
    "reference_mode": {
      "state": "LOCKED",
      "source_type": "user",
      "source_id": "user+composition-source",
      "prompt_required": false
    },
    "subject.age_range": {
      "state": "LOCKED",
      "source_type": "user",
      "source_id": "user",
      "prompt_required": true
    },
    "subject.sex": {
      "state": "LOCKED",
      "source_type": "user",
      "source_id": "user+composition-source",
      "prompt_required": true
    },
    "subject.sport": {
      "state": "LOCKED",
      "source_type": "user",
      "source_id": "user+composition-source",
      "prompt_required": true
    }
  },
  "brief_hash": "6fccf59b4ab00f6fac7c11be5b350141304875b1067de538f78feae95393b365",
  "delta_history": [
    {
      "delta_hash": "399a231422ef0afee7b1a7c227bae27407f948df15348d480d059a4350b6f06a",
      "authorized_by": "user",
      "reason": "Resolve required player age from authorized composition source/user confirmation",
      "paths": [
        "subject.age_range"
      ]
    }
  ]
}